,name,description,image,url,offers/price,store
0,The Torsa Kurta Set - White,"name: The Torsa Kurta Set - White, brand/slogan: Nicobar, description: 
The Torsa Kurta Set brings together the Torsa Kurta and Numa Pants in crisp white, designed as an effortless summer pairing.

The kurta is crafted in organic cotton voile with white on white chikankari and mukaish dots on the yoke for delicate texture.

The pants balance the look with airy cotton voile, finished with a blue striped selvedge detail along the side seam.

Completed with subtle red accents and clean craftsmanship, this set blends lightness, ease, and craft in cotton and threadwork.
",https://cdn.shopify.com/s/files/1/0270/5129/4854/files/1_354a26f8-0fd3-493e-8c35-f41d10ae9b98.jpg?v=1770280013,https://www.nicobar.com/products/the-torsa-kurta-set-white,12000.0,Nicobar
1,The Rin Top Set - Grey & White Stripes,"name: The Rin Top Set - Grey & White Stripes, brand/slogan: Nicobar, description: 
The Rin Top Set pairs the Rin Top with Costa Pants in soft grey and white stripes, clean, crisp, and easy to wear together.

The top is crafted in lyocell linen stripes, finished with an ice blue flower applique placed on the front panel.

The striped pants carry the same graphic rhythm, completed with a grey shell button at the waistband for subtle structure.

Together, the set balances cool tones, breathable texture, and a single crafted accent.
",https://cdn.shopify.com/s/files/1/0270/5129/4854/files/1_9409e013-47fd-44d5-a8a0-7b9e40164c49.jpg?v=1770634650,https://www.nicobar.com/products/the-rin-top-set-grey-white-stripes,9500.0,Nicobar
2,The Giri Kurta Set - Blue & White,"name: The Giri Kurta Set - Blue & White, brand/slogan: Nicobar, description: 
The Giri Kurta Set pairs the Giri Kurta with the Aven Pants in riverside blues, a fresh coordinated look for warm days.

The kurta features windowpane checks with a chikankari jaali heart on the sleeve and contrast piping at the neckline.

The linen pants arrive in a garment dyed riverside blue, finished with an extended waistband and a button stitched in red thread.

Together, the set balances crisp pattern, breathable fabric, and small signature details.
",https://cdn.shopify.com/s/files/1/0270/5129/4854/files/5_bb8366b5-baf6-43eb-a86d-c18469789a29.jpg?v=1771309738,https://www.nicobar.com/products/the-giri-kurta-set-blue-white,10500.0,Nicobar
3,The Rann Shirt Set - Grey & White Stripes,"name: The Rann Shirt Set - Grey & White Stripes, brand/slogan: Nicobar, description: 
The Rann Shirt Set brings together the Rann Shirt and Costa Pants in matching grey and white stripes for a clean, graphic statement.

The shirt is crafted in yarn dyed cotton stripes with a red heart block print placed at the back corner as a bold accent.

The pants continue the striped rhythm, finished with a grey shell button at the waistband for subtle polish.

This set is sharp, simple, and designed with just enough contrast to stand out.
",https://cdn.shopify.com/s/files/1/0270/5129/4854/files/1_ad5e9a9e-fdc2-4793-aa6c-f12ddca25f7f.jpg?v=1770279968,https://www.nicobar.com/products/the-rann-shirt-set-grey-white-stripes,8250.0,Nicobar
4,The Calicut Kurta Set - White,"name: The Calicut Kurta Set - White, brand/slogan: Nicobar, description: 
The Calicut Kurta Set brings together the Calicut Kurta and Numa Pants in crisp white, elevated through small crafted accents.

The kurta features white on white chikankari, a moon patch in red checks, smocking on the cap sleeves, and a high low hem with charcoal check piping.

The pants are cut in organic cotton voile, finished with a blue striped selvedge running along the side seam.

Clean, light, and detailed up close, this set balances contrast and summer ease.
",https://cdn.shopify.com/s/files/1/0270/5129/4854/files/1_07b75941-75de-4db2-9fd8-6aac7d146cc1.jpg?v=1770634774,https://www.nicobar.com/products/the-calicut-kurta-set-white,13500.0,Nicobar
5,The Dhauli Kurta Set - Grey & White Checks,"name: The Dhauli Kurta Set - Grey & White Checks, brand/slogan: Nicobar, description: 
The Dhauli Kurta Set brings together the Dhauli Kurta and Yoka Trousers in bold charcoal and white checks for a striking coordinated look.

The kurta features all over floral embroidery with red pleating at the back collar and slit sleeves as a modern twist.

The trousers continue the gingham base with bias check patch pockets and a light green heart embroidery at the pocket corner.

Finished with contrast, craft, and clean structure, this set feels sharp yet effortless.
",https://cdn.shopify.com/s/files/1/0270/5129/4854/files/1_bf320349-ea98-4741-b2ae-13af53d55f5b.jpg?v=1770279838,https://www.nicobar.com/products/the-dhauli-kurta-set-grey-white-checks,14250.0,Nicobar
6,The Meadow Kurta Set - Ivory,"name: The Meadow Kurta Set - Ivory, brand/slogan: Nicobar, description: 
The Meadow Kurta Set pairs the Meadow Kurta with Breeze Pants in soft ivory tones, rich in embroidery and texture.

The kurta is crafted in cotton silk chanderi with all over aari dots and orange chinar leaf embroidery scattered like reflections on water.

The cotton kora pants add a grounded finish, detailed with red boondi dots on the upper panel and a fish motif at the hem.

This set blends luminous fabric, intricate threadwork, and an easy summer palette.
",https://cdn.shopify.com/s/files/1/0270/5129/4854/files/1_1ffa5b7b-9bf1-4e4f-a643-db0810326b7a.jpg?v=1770790449,https://www.nicobar.com/products/the-meadow-kurta-set-ivory,14500.0,Nicobar
7,The Imke Kurta Set - Multicolour,"name: The Imke Kurta Set - Multicolour, brand/slogan: Nicobar, description: 
The Imke Kurta Set brings together the Imke Kurta and Classic Pyjamas in multicolour prints designed for playful comfort.

Inspired by Kashmiri kani shawls, the kurta’s heart and bird motifs are woven into running stripes, finished with a moon patch in diagonal stripes.

The pyjamas echo the same kani inspired stripe rhythm in airy organic cotton voile with an elasticated back waistband.

Together, the set is light, joyful, and full of movement in print and colour.
",https://cdn.shopify.com/s/files/1/0270/5129/4854/files/1_05f976fe-aef8-440f-9392-98624ff7bff8.jpg?v=1770634860,https://www.nicobar.com/products/the-imke-kurta-set-multicolour,10500.0,Nicobar
8,The Kohima Kaftan Set - Multicolour,"name: The Kohima Kaftan Set - Multicolour, brand/slogan: Nicobar, description: 
The Kohima Kaftan Set pairs the Kohima Kaftan with Numa Pants in crisp whites, designed as an easy summer set with print and detail in balance. 

The kaftan is crafted in organic cotton voile with a placement print of birds and blooming flowers, like a river garden in full colour. 

The pants keep things clean and breathable, finished with a blue striped selvedge running along the side seam as a subtle accent. 

Together, the set blends airy voile comfort, crafted finishing, and a sense of escape in print and texture.
",https://cdn.shopify.com/s/files/1/0270/5129/4854/files/1_b1c8e265-7280-4044-a04b-fd21f00a9d47.jpg?v=1770279528,https://www.nicobar.com/products/the-kohima-kaftan-set-multicolour,10000.0,Nicobar
9,The Kiva Set - White & Red Printed,"name: The Kiva Set - White & Red Printed, brand/slogan: Nicobar, description: 
The Kiva Top Set pairs the Kiva Top with the Billow Skirt in white and red prints, full of summer bloom and texture.

The top features red gulmohar flowers with an ice blue heart centre, finished with frayed edges and a red heart embroidery at the hem corner.

The skirt continues the gulmohar print with a paperbag waistband and a charcoal gingham side drawstring for a cool twist.

Together, the set blends florals, craft, and an easy statement silhouette.
",https://cdn.shopify.com/s/files/1/0270/5129/4854/files/1_076bb9e5-9d32-4a72-b632-0233104b48ec.jpg?v=1770279488,https://www.nicobar.com/products/the-kiva-top-set-white-red-printed,8750.0,Nicobar
10,The Malti Shirt Set - Blue,"name: The Malti Shirt Set - Blue, brand/slogan: Nicobar, description: 
The Mati Shirt Set brings together the Mati Shirt and Aven Pants in riverside blue, relaxed yet refined.

The linen shirt carries a garment washed finish, completed with a metal heart coin hanging at the back yoke as a small signature accent.

The pants are crafted in garment dyed linen, finished with an extended waistband and a front button stitched in red thread.

Together, the set blends texture, tone, and subtle detailing in easy summer linen.
",https://cdn.shopify.com/s/files/1/0270/5129/4854/files/1_863d9655-fd95-44fc-a719-a6c0696a2ae9.jpg?v=1770279402,https://www.nicobar.com/products/the-malti-shirt-set-blue,13000.0,Nicobar
11,The Ela Shirt Set - Ice Blue,"name: The Ela Shirt Set - Ice Blue, brand/slogan: Nicobar, description: 
The Ela Shirt Set pairs the Ela Shirt with Leni Pants in ice blue, crisp, clean, and full of small crafted touches.

The shirt is cut in cotton lycra poplin with peeping bird embroidery and a charcoal gingham heart patch placed at the elbow.

The pants bring structure with a red heart icon embroidery at the waistband and a delicate shell button finish.

Together, the set balances polish, softness, and signature detail in cool summer blues.
",https://cdn.shopify.com/s/files/1/0270/5129/4854/files/1_5be41701-b6f3-4e0e-be9f-7ebddcdddc49.jpg?v=1770790531,https://www.nicobar.com/products/the-ela-shirt-set-ice-blue,9500.0,Nicobar
12,The Bea Kaftan Set - Multicolour,"name: The Bea Kaftan Set - Multicolour, brand/slogan: Nicobar, description: 
The Bea Kaftan Set brings together the Bea Kaftan and Numa Pants in multicolour prints and clean whites for an easy standout look.

The kaftan features bold poppies in blue and lime green on voile, vibrant yet effortless in silhouette.

The pants are crafted in organic cotton voile, finished with a blue striped selvedge running along the side seam.

Together, the set balances colour, comfort, and graphic freshness.
",https://cdn.shopify.com/s/files/1/0270/5129/4854/files/1_7ea6fef5-fb12-481d-bb4b-180b38547a1e.jpg?v=1770279286,https://www.nicobar.com/products/the-bea-kaftan-set-multicolour,10000.0,Nicobar
13,The Mirai Kurta Set - Ivory,"name: The Mirai Kurta Set - Ivory, brand/slogan: Nicobar, description: 
The Mirai Kurta Set pairs the Mirai Kurta with Breeze Pants in soft ivory tones, understated and detailed up close.

The kurta is crafted in cotton kora with placement applique work and a blue and white check heart at the back shoulder.

The pants add texture through cotton kora, finished with red boondi dots on the upper panel and a fish embroidery at the hem.

Together, the set balances simplicity, craft, and gentle motif detailing.
",https://cdn.shopify.com/s/files/1/0270/5129/4854/files/1_c390c5c1-78a0-4f1e-bb47-54e2f697ead3.jpg?v=1770279201,https://www.nicobar.com/products/the-mirai-kurta-set-ivory,11000.0,Nicobar
14,The Ayra Set - Green & White,"name: The Ayra Set - Green & White, brand/slogan: Nicobar, description: 
The Ayra Top Set pairs the Ayra Top with Paperbag Pants in light green and white checks, fresh, easy, and made for summer days.

The top features a peeping bird embroidery stitched in ice blue thread, with a godet cut on the bias for soft movement.

The pants continue the check rhythm, finished with riverside selvedge accents and a shell fabric drawstring with red shell buttons.

Together, the set blends playful detail, breathable cotton comfort, and thoughtful finishing in an effortless co ord look.
",https://cdn.shopify.com/s/files/1/0270/5129/4854/files/1_0f41a37c-dc04-473f-8c50-f3afd29ae5b0.jpg?v=1770279160,https://www.nicobar.com/products/the-ayra-top-set-green-white,8250.0,Nicobar
15,The Tab Top Set - Charcoal,"name: The Tab Top Set - Charcoal, brand/slogan: Nicobar, description: 
The Tab Top Set pairs the Tab Top with Ebb Joggers in deep charcoal, designed for simplicity with a modern edge.

The top is crafted in bamboo seersucker with a small icon embroidery and pleat detailing at the centre back.

The joggers match in textured seersucker, finished with fluorescent orange piping highlighting the coin pocket at the side.

Together, the set balances clean lines, comfort, and a sharp pop of contrast.
",https://cdn.shopify.com/s/files/1/0270/5129/4854/files/1_0668fd05-0fd6-479b-871c-d63042f58b5f.jpg?v=1770790622,https://www.nicobar.com/products/the-tab-top-set-charcoal,9500.0,Nicobar
16,The Lazy sunday Tunic Set - Red,"name: The Lazy sunday Tunic Set - Red, brand/slogan: Nicobar, description: 
A set of two of our signature styles, the Lazy Sunday Tunic and Serene Pants in red.

Crafted in light and crisp organic cotton with batwing sleeves, the Lazy Sunday Tunic works effortlessly from the boardroom to lounging by the pool.

Elevate your style effortlessly with the most versatile addition to your wardrobe - the Seren Pants that seamlessly complement any look, whether dressed up or dressed down.


",https://cdn.shopify.com/s/files/1/0270/5129/4854/files/1_18765fa3-5883-4c49-b7fc-c22f77eb94cd.jpg?v=1741863493,https://www.nicobar.com/products/the-lazy-sunday-tunic-red,10500.0,Nicobar
17,The Basic Long Length Kurta Set - Navy,"name: The Basic Long Length Kurta Set - Navy, brand/slogan: Nicobar, description: 
A set of two of our signature styles, the Basic Long Length Kurta and Yoka Trousers in navy.

This easy-wearing kurta falls below the knee, and with its body-skimming fit, it adds a touch of effortless style to your look.

What's comfortable, effortless, and comes in an easy silhouette? Our Yoka Trousers. This style features a tight waist and generous pockets 

",https://cdn.shopify.com/s/files/1/0270/5129/4854/files/1_a53f0f78-76d3-4dc8-8334-bfcafe239a51.jpg?v=1741863795,https://www.nicobar.com/products/the-basic-long-length-kurta-set-navy,9950.0,Nicobar
18,The Basic Mid Length Kurta Set - Green,"name: The Basic Mid Length Kurta Set - Green, brand/slogan: Nicobar, description: 
A set of two of our signature styles, the Basic Mid Length Kurta and Basic Pyjama in green.

An easy-wearing, relaxed kurta with slits along the sides for fuss-free movement.

The set also features matching Basic Pyjama, a style that's come to be our signature. This pyjama features an a-line silhouette that ends in a gentle flare.
",https://cdn.shopify.com/s/files/1/0270/5129/4854/files/1_fc8532ff-e7ff-4dd9-baa4-c9562c866550.jpg?v=1742212941,https://www.nicobar.com/products/the-basic-mid-length-kurta-set-green,7050.0,Nicobar
19,The Lazy Sunday Tunic Set - White,"name: The Lazy Sunday Tunic Set - White, brand/slogan: Nicobar, description: 
A set of two of our signature styles, the Lazy Sunday Tunic and Basic Pyjama in white.
With classic batwing sleeves, the Lazy Sunday Tunic works effortlessly from the boardroom to lounging by the pool.
The set also features Basic Pyjama, a style that's come to be our signature. This pyjama features an a-line silhouette that ends in a gentle flare.
",https://cdn.shopify.com/s/files/1/0270/5129/4854/files/1_898e3bcb-c732-4355-a07e-19d582680b46.jpg?v=1741863116,https://www.nicobar.com/products/the-lazy-sunday-tunic-set-white,8750.0,Nicobar
20,The Mandarin Collar Set - Green,"name: The Mandarin Collar Set - Green, brand/slogan: Nicobar, description: 
A set of two of our signature styles, the Mandarin Collar Top and Serene Pants in green.
Your new workwear staple! This classic and timeless top is perfect for any work environment.
Elevate your style effortlessly with the most versatile addition to your wardrobe - a pair of pants that seamlessly complement any look, whether dressed up or dressed down.
",https://cdn.shopify.com/s/files/1/0270/5129/4854/files/1_e2de0807-04f1-46d4-a977-3cc56ebf30e6.jpg?v=1741086099,https://www.nicobar.com/products/the-mandarin-collar-set-green,8650.0,Nicobar
21,The High Slit Top Set - Green,"name: The High Slit Top Set - Green, brand/slogan: Nicobar, description: 
A set of two of our signature styles, the High Slit Top and Serene Pants in green.
Easy to pair with every other piece in your closet, this top features high side slits on either side, giving it a sophisticated and modern look. The green hue and relaxed cut makes it easy to pair with any outfit, adding a touch of effortless style to your look.
Elevate your style effortlessly with the most versatile addition to your wardrobe - a pair of pants that seamlessly complement any look, whether dressed up or dressed down.
",https://cdn.shopify.com/s/files/1/0270/5129/4854/files/1_6d906a2f-7da7-4821-9883-0c5ea4bf4f59.jpg?v=1741085852,https://www.nicobar.com/products/the-high-slit-top-set-green,9700.0,Nicobar
22,Drop Armhole Shirt Set - Green,"name: Drop Armhole Shirt Set - Green, brand/slogan: Nicobar, description: 
A set of two of our signature styles, the Drop Armhole Shirt and Serene Pants in green.
Our Drop Armhole Shirt is perfect for any occasion, whether it's a day at the office or a casual brunch with your friends. The green hue and versatile cut makes it easy to pair with any outfit, adding a touch of effortless style to your look.
Elevate your style effortlessly with the most versatile addition to your wardrobe - a pair of pants that seamlessly complement any look, whether dressed up or dressed down.
",https://cdn.shopify.com/s/files/1/0270/5129/4854/files/1_e11a42c4-6bfd-4940-b2d8-32b3bdb66ad7.jpg?v=1742194146,https://www.nicobar.com/products/drop-armhole-shirt-set-green,10250.0,Nicobar
23,The Mandarin Collar Set - Charcoal,"name: The Mandarin Collar Set - Charcoal, brand/slogan: Nicobar, description: 
A set of two of our signature styles, the Mandarin Collar Top and Yoka Trousers in charcoal.
Your new workwear staple! This classic and timeless top is perfect for any work environment.
Pocket full of personality! Our charcoal and white striped Yoka Trousers are an easy pick for a flared fit and to amp up your outfit.
",https://cdn.shopify.com/s/files/1/0270/5129/4854/files/1_dc068016-0f28-4f81-b725-8eb943f821ef.jpg?v=1741609476,https://www.nicobar.com/products/the-mandarin-collar-set-charcoal,10250.0,Nicobar
24,The Mandarin Collar Set - Red,"name: The Mandarin Collar Set - Red, brand/slogan: Nicobar, description: 
A set of two of our signature styles, the Mandarin Collar Top and Serene Pants in red.
Your new workwear staple! This classic and timeless top is perfect for any work environment.
Elevate your style effortlessly with the most versatile addition to your wardrobe - a pair of pants that seamlessly complement any look, whether dressed up or dressed down.
",https://cdn.shopify.com/s/files/1/0270/5129/4854/files/NBI032511_1_0ca6289f-63f0-47a9-8973-78f93ac5917d.jpg?v=1741887197,https://www.nicobar.com/products/the-mandarin-collar-set-red,8750.0,Nicobar
25,The Basic Long Length Kurta Set - Green,"name: The Basic Long Length Kurta Set - Green, brand/slogan: Nicobar, description: 
A set of two of our signature styles, the Basic Long Length Kurta and Basic Pyjamas in green.
This easy-wearing kurta falls below the knee, and with its body-skimming fit, it pairs perfectly with pyjamas or a pair of jeans. The green hue and relaxed cut makes it easy to pair with any outfit, adding a touch of effortless style to your look.
Elevate your style effortlessly with the most versatile addition to your wardrobe - a pair of pants that seamlessly complement any look, whether dressed up or dressed down.
",https://cdn.shopify.com/s/files/1/0270/5129/4854/files/1_7fb5148f-5ec9-4ecd-b7cb-3295f52e9bc5.jpg?v=1741076481,https://www.nicobar.com/products/the-basic-long-length-kurta-set-green,7600.0,Nicobar
26,The Lazy Sunday Tunic Set - Green,"name: The Lazy Sunday Tunic Set - Green, brand/slogan: Nicobar, description: 
A set of two of our signature styles, the Lazy Sunday Tunic and and Basic Pyjamas in green.
Crafted in light and seersucker with batwing sleeves, this piece works effortlessly from the boardroom to lounging by the pool.
Elevate your style effortlessly with the most versatile addition to your wardrobe - a pair of pants that seamlessly complement any look, whether dressed up or dressed down.
",https://cdn.shopify.com/s/files/1/0270/5129/4854/files/1_b39ff80b-96c0-4286-8ea6-71bdb1329a4c.jpg?v=1741078485,https://www.nicobar.com/products/the-lazy-sunday-tunic-set-green,8650.0,Nicobar
27,The Basic Mid Length Kurta  Set - Red,"name: The Basic Mid Length Kurta  Set - Red, brand/slogan: Nicobar, description: 
A set of two of our signature styles, the Basic Mid Length Kurta and Basic Pyjamas in red.
An easy-wearing, relaxed kurta with slits along the sides for fuss-free movement. The red hue and relaxed cut makes it easy to pair with any outfit, adding a touch of effortless style to your look.
Elevate your style effortlessly with the most versatile addition to your wardrobe - a pair of pants that seamlessly complement any look, whether dressed up or dressed down.
",https://cdn.shopify.com/s/files/1/0270/5129/4854/files/1_adb1abe0-a0c5-4302-952e-1f3f07d3643c.jpg?v=1742193608,https://www.nicobar.com/products/the-basic-mid-length-kurta-set-red,7250.0,Nicobar
28,The Drop Armhole Shirt Set - Beige,"name: The Drop Armhole Shirt Set - Beige, brand/slogan: Nicobar, description: 
A set of two of our signature styles, the Drop Armhole Shirt and Serene Pants in beige.
Our Drop Armhole Shirt is perfect for any occasion, whether it's a day at the office or a casual brunch with your friends. The beige hue and versatile cut makes it easy to pair with any outfit, adding a touch of effortless style to your look.
Elevate your style effortlessly with the most versatile addition to your wardrobe - a pair of pants that seamlessly complement any look, whether dressed up or dressed down.
",https://cdn.shopify.com/s/files/1/0270/5129/4854/files/5_7b083785-7766-4acd-96fc-eae3250919d0.jpg?v=1741668442,https://www.nicobar.com/products/the-drop-armhole-shirt-set-beige,10250.0,Nicobar
29,The Drop Armhole Shirt Set - Red,"name: The Drop Armhole Shirt Set - Red, brand/slogan: Nicobar, description: 
A set of two of our signature styles, the Drop Armhole Shirt and Serene Pants in red.
Our Drop Armhole Shirt is perfect for any occasion, whether it's a day at the office or a casual brunch with your friends. The red hue and versatile cut makes it easy to pair with any outfit, adding a touch of effortless style to your look.
Elevate your style effortlessly with the most versatile addition to your wardrobe - a pair of pants that seamlessly complement any look, whether dressed up or dressed down.
",https://cdn.shopify.com/s/files/1/0270/5129/4854/files/5_a4e7adc4-4f53-4a80-bf67-1541d320cabc.jpg?v=1741886004,https://www.nicobar.com/products/the-drop-armhole-shirt-set-red,10250.0,Nicobar
30,The Serene Set,"name: The Serene Set, brand/slogan: Nicobar, description: 
A set of two of our signature styles, the High Slit Top and Serene Pants in ochre, the perfect pair for lounging.

Crafted in light and crisp cotton, the shirt's loose fit and contemporary design make it a favourite from day to night. The pyjama features an a-line silhouette that ends in a gentle flare.

The bright yellow hue makes this an easy pick to wear from day to night, whether you’re wearing it to your desk or a dinner with the gang.
",https://cdn.shopify.com/s/files/1/0270/5129/4854/files/5_5066bb7e-667d-465f-95a5-68403698f248.jpg?v=1717163714,https://www.nicobar.com/products/the-serene-set,9700.0,Nicobar
31,The Stone Set,"name: The Stone Set, brand/slogan: Nicobar, description: 
A set of two of our signature styles, the Basic Mid Length Kurta and the Basic Pyjama in black, the perfect pair for lounging.

Crafted in light and crisp organic cotton, this easy-wearing kurta falls below the knee with a body-skimming fit. The pyjama features an a-line silhouette that ends in a gentle flare. 

The black hue makes this matching set an easy pick to wear from day to night, whether you’re wearing it to your desk or a dinner with the gang.
",https://cdn.shopify.com/s/files/1/0270/5129/4854/files/1_84eccb5c-f546-4538-9c22-a204b58e67e0.jpg?v=1717135425,https://www.nicobar.com/products/the-stone-set,7250.0,Nicobar
32,The Ice Set,"name: The Ice Set, brand/slogan: Nicobar, description: 
A set of two of our signature styles, the Basic Mid Length Kurta and the Basic Pyjamas in white, the perfect pair for lounging.

Crafted in light seersucker, the kurta has a relaxed fit and long sleeves. The pyjama features an a-line silhouette that ends in a gentle flare. 

The classic white hue makes this matching set an easy pick to spend sunny days in, whether you’re lounging by the pool or off to a breezy brunch.
",https://cdn.shopify.com/s/files/1/0270/5129/4854/files/1_91b0afe6-dd71-4fc1-aa7b-4d281f69ae39.jpg?v=1717134279,https://www.nicobar.com/products/the-ice-set,8250.0,Nicobar
33,The Eclipse Set,"name: The Eclipse Set, brand/slogan: Nicobar, description: 
A set of two of our signature styles, the Lazy Sunday Tunic and the Basic Pyjama in black, the perfect pair to take from morning to evening.

Crafted in light and crisp organic cotton with batwing sleeves, the tunic works effortlessly. The pyjama features an a-line silhouette that ends in a gentle flare.

The classic black hue makes this matching set an easy pick to wear from day to night, whether you’re wearing it to your desk or a dinner with the gang.
",https://cdn.shopify.com/s/files/1/0270/5129/4854/files/4_8127e694-1877-4476-95f4-89759e6c5196.jpg?v=1717163146,https://www.nicobar.com/products/the-eclipse-set,8750.0,Nicobar
