,name,description,image,url,offers/price,store
396,Hampi Top - Chartreuse,"name: Hampi Top - Chartreuse, brand/slogan: Nicobar, description: 
Comfy, glowing and in a relaxed silhouette, the Hampi Top in chartreuse is a versatile celebration piece.Blending artisanal detailing with an easy fit, it effortlessly bridges everyday ease and occasion dressing. 

Crafted in a luxurious mashru, the fabric offers a gentle sheen with a fluid, soft drape, ideal for transitional weather and festive layering. 

High side slits reveal a playful peek of printed facing, a hidden detail that turns a simple motion into a moment of magic.

Tailored with clean lines and minimal seams, the top features thoughtfully finished facings and a moonpatch, all blind-hemmed for an understated, seamless finish. 

Spot a delicate gold sequin star, accented with petite purple sequins and a single purple bead, hand-embroidered on the wearer’s right sleeve. This subtle embellishment adds a touch of whimsy and sparkle, capturing the spirit of celebration.

",https://cdn.shopify.com/s/files/1/0270/5129/4854/files/NBI046633_1.jpg?v=1757995196,https://www.nicobar.com/products/hampi-top-chartreuse,6550.0,Nicobar
397,Ayat Pyjamas - Turmeric Yellow,"name: Ayat Pyjamas - Turmeric Yellow, brand/slogan: Nicobar, description: 
The Ayat Pyjamas bring colour to the everyday—rooted, radiant, and easy to move in.

Crafted in 100% cotton in solid turmeric yellow, they’re finished with silver triangle gota along the side slit for a subtle festive edge.

A small red paan patta is embroidered on the leg panel—quiet detail, placed just so.
",https://cdn.shopify.com/s/files/1/0270/5129/4854/files/NBI045941_1.jpg?v=1753768983,https://www.nicobar.com/products/ayat-pyjamas-turmeric-yellow,3950.0,Nicobar
398,Side Tuck Pants - Denim,"name: Side Tuck Pants - Denim, brand/slogan: Nicobar, description: 
The Side Tuck Pants bring that easy, lived-in denim mood to winter, the kind of blue that feels familiar, relaxed, and endlessly wearable.

Crafted in medium-wash cotton denim, they’re designed with subtle side tucks that give the silhouette a gentle shape and an everyday ease.

A pixelated heart embroidery at the pocket corner adds a small, signature touch to this all-season staple.
",https://cdn.shopify.com/s/files/1/0270/5129/4854/files/NBI047584_1.jpg?v=1763621220,https://www.nicobar.com/products/side-tuck-pants-denim,6500.0,Nicobar
399,Salem Pants - Fuchsia & Gold Printed,"name: Salem Pants - Fuchsia & Gold Printed, brand/slogan: Nicobar, description: 
Bold and full of character, the Salem Pants come in fuchsia and gold. With a gently puffy silhouette, these pants offer a playful yet polished look that's easy to dress up or down.

Crafted from cotton linter, a natural byproduct of cottonseed oil production, Bemberg is a regenerated cellulose fibre that’s soft, breathable, and gentle on the skin. It’s biodegradable, compostable, and made using a closed-loop process that minimises waste, making it a thoughtful choice for you and the planet.

Functional details include pockets and a relaxed fit for all-day comfort.

Spot a Mashru heart patch on wearer’s left side seam just above the hem—subtle, yet statement-making.

Perfect for festive pairings or as a standout everyday piece, style it with a simple top and flats for effortless charm.
",https://cdn.shopify.com/s/files/1/0270/5129/4854/files/NBI046694_1.jpg?v=1757069745,https://www.nicobar.com/products/salem-pants-fuchsia-gold-printed,4700.0,Nicobar
400,Paperbag Pants - Green,"name: Paperbag Pants - Green, brand/slogan: Nicobar, description: 
Comfort meets style with our classic Paperbag Waist Pants.These pants come in a vibrant bright green that adds energy to any outfit. 

Crafted from cotton linter, a natural byproduct of cottonseed oil production, Bemberg is a regenerated cellulose fibre that’s soft, breathable, and gentle on the skin. It’s biodegradable, compostable, and made using a closed-loop process that minimises waste, making it a thoughtful choice for you and the planet.

The high-waisted silhouette features gathered detailing with pockets for a seamless finish.

Find a heart-shaped mirror embroidered at the hem, to be handled with care.

A delicate ode to India’s traditional shisha embroidery, this piece reimagines the craft with a contemporary twist making it modern Indian.
",https://cdn.shopify.com/s/files/1/0270/5129/4854/files/NBI046701_1.jpg?v=1758087475,https://www.nicobar.com/products/paperbag-pants-green,5250.0,Nicobar
401,Fit & Flare Angrakha - Ivory Embroidered,"name: Fit & Flare Angrakha - Ivory Embroidered, brand/slogan: Nicobar, description: 
The Fit &amp; Flare Angrakha is light, textured, and quietly festive—made for days that carry a rhythm of their own.

Crafted in breathable cotton kora, it’s embroidered all over with tonal florals, with criss-cross detailing on the back panel and delicate leaf motifs at the neckline.

The flared silhouette adds movement, while the clean finish keeps it grounded in ease.
",https://cdn.shopify.com/s/files/1/0270/5129/4854/files/NBI045907_1.jpg?v=1753681584,https://www.nicobar.com/products/fit-flare-angrakha-ivory-embroidered,8500.0,Nicobar
402,Areca Pants - Charcoal & Ivory Stripes,"name: Areca Pants - Charcoal & Ivory Stripes, brand/slogan: Nicobar, description: 
The Areca Pants are made for days when ease and intention go hand in hand.

Crafted in 100% cotton voile with charcoal and ivory shibori stripes, the mid-rise silhouette features a straight leg and side pockets for everyday function.

A small watermelon heart is embroidered just below the pocket—an unexpected detail that makes them distinctly yours.

Shibori is a hand-dyed technique—each piece will vary slightly in pattern and tone, making it one of a kind.
",https://cdn.shopify.com/s/files/1/0270/5129/4854/files/NBI045880_1.jpg?v=1753768984,https://www.nicobar.com/products/areca-pants-charcoal-ivory-stripes,4000.0,Nicobar
403,Ren Top - White Print,"name: Ren Top - White Print, brand/slogan: Nicobar, description: 
The Ren Top in white is a breezy addition to any wardrobe, crafted from 100% organic cotton for a lightweight, breathable feel. Soft clouds float across it while the inside features contrasting aqua stripes.

Spot a delicate bullion knot rose embroidery at the side.

Dress this piece up or down for effortless style to throw on and go.
",https://cdn.shopify.com/s/files/1/0270/5129/4854/files/NBI037950_1.jpg?v=1738836029,https://www.nicobar.com/products/ren-top-white-print,3950.0,Nicobar
404,Tropico Shirt - Green Printed,"name: Tropico Shirt - Green Printed, brand/slogan: Nicobar, description: 
The Tropico Shirt comes in a cool, camouflaged print, perfect for safaris. Blending the calm of the desert with the wild spirit of the jungle, Safar is a collection designed for exploration—capturing the journey within, before it even begins.

Crafted from light cotton cambri. 

Delightful details abound: signature Nicobar animals and lush motifs scattered all over.

Great for heading on safari or a trip to the jungle.
",https://cdn.shopify.com/s/files/1/0270/5129/4854/files/NBI040202_1.jpg?v=1746192540,https://www.nicobar.com/products/tropico-shirt-green-printed,4700.0,Nicobar
405,Gusset Long Kurta - Red,"name: Gusset Long Kurta - Red, brand/slogan: Nicobar, description: 
The Gusset Long Kurta makes a statement with its efforltess fall and red hue.

The full sleeves, V-neck and gathers make this one a head-turner, all with twinkling details.

Crafted in light cotton, dress this piece up or down for your everyday or celebrations alike.

Spot a gold- foiled moon at the right sleeve and antique gold gota triangles at the neckline.


",https://cdn.shopify.com/s/files/1/0270/5129/4854/files/NBI036094_1.jpg?v=1727451290,https://www.nicobar.com/products/gusset-long-kurta-red,10000.0,Nicobar
406,Gusset Round Neck Kurta - Deep Green Embroidered,"name: Gusset Round Neck Kurta - Deep Green Embroidered, brand/slogan: Nicobar, description: 
The Gusset Round Neck Kurta makes a statement with its effortless fall and green hue.

The full sleeves, round neck and gathers make this one a head-turner, all with twinkling details.

Crafted in light cotton, dress this piece up or down for your everyday or celebrations alike.

The design features buttons stitched with red thread, a gold metal flower embroidered neckline with shell fabric piping and red corded embroidery at the sleeve hem.

Spot gold sequin lines embroidered with red thread on the sleeve bicep and a tassel detail attached to the button loop at the back.


",https://cdn.shopify.com/s/files/1/0270/5129/4854/files/NBI036101_1.jpg?v=1727451288,https://www.nicobar.com/products/gusset-round-neck-kurta-deep-green-embroidered,13150.0,Nicobar
407,V-Neck Strappy Dress - White & Purple Printed,"name: V-Neck Strappy Dress - White & Purple Printed, brand/slogan: Nicobar, description: 
Light as a tropical breeze, the Neck Strappy Dress is made for sun-soaked days and spontaneous escapes. It features an all-over floral parrot print that brings a playful rhythm to the silhouette.

Crafted in soft, 100% organic cotton voile.

The contrast comes alive in the details—chartreuse binding at the hem and purple check straps add unexpected charm.

Cut in a relaxed A-line fit, it flatters while keeping things effortlessly cool.

Easy to slip into, hard to forget—this is carefree summer dressing at its best.
",https://cdn.shopify.com/s/files/1/0270/5129/4854/files/NBI045413_1.jpg?v=1747286737,https://www.nicobar.com/products/v-neck-strappy-dress-white-purple-printed,8400.0,Nicobar
408,Vintage Camisole - White & Fuchsia Print,"name: Vintage Camisole - White & Fuchsia Print, brand/slogan: Nicobar, description: 
The Vintage Camisole is crafted from 100% organic cotton, featuring a delicate ditsy rose print on a crisp white base. 

The soft, breathable fabric ensures comfort, while the lace detailing along the neckline and hemline adds a feminine, vintage touch. 

Perfect for layering or wearing on its own, this camisole offers a blend of classic charm and modern sustainability.
",https://cdn.shopify.com/s/files/1/0270/5129/4854/files/NBI037814_1.jpg?v=1738836035,https://www.nicobar.com/products/vintage-camisole-white-fuchsia-print,3650.0,Nicobar
409,Basic Long Length Kurta - Black & Beige Printed,"name: Basic Long Length Kurta - Black & Beige Printed, brand/slogan: Nicobar, description: 
This easy-wearing kurta falls below the knee, and with its body-skimming fit, it pairs perfectly with pyjamas or a pair of jeans.

The black-and-beige striped print and relaxed cut make it easy to pair with any outfit, adding a touch of effortless style to your look. Find a mulberry heart under the placket and all-over rose embroidery that brings soft texture to the silhouette.

Designed with stripes running across the surface, it offers a subtle play of pattern through the day.
",https://cdn.shopify.com/s/files/1/0270/5129/4854/files/NBI047803_1.jpg?v=1763621220,https://www.nicobar.com/products/basic-long-length-kurta-black-beige-printed,7500.0,Nicobar
410,Basic Mid Length Kurta - Chartreuse & Gold Printed,"name: Basic Mid Length Kurta - Chartreuse & Gold Printed, brand/slogan: Nicobar, description: 
This easy-wearing kurta falls above the knee, and with its body-skimming fit, it pairs perfectly with pyjamas or a pair of jeans. The chartreuse base is brought to life with a delicate gold palm print, adding a subtle festive sparkle.

Bright, breezy, and effortlessly elegant, this mid-length kurta is crafted from 100% organic cotton voile for all-day comfort.

Spot a diagonal gold gota detail tucked under the placket, catching light with every movement.
",https://cdn.shopify.com/s/files/1/0270/5129/4854/files/NBI046840_1.jpg?v=1757069751,https://www.nicobar.com/products/basic-mid-length-kurta-chartreuse-gold-printed,6300.0,Nicobar
411,Vestige Kurta - Ivory,"name: Vestige Kurta - Ivory, brand/slogan: Nicobar, description: 
The Vestige Kurta brings a quiet, understated elegance to winter in a soft ivory that feels light, gentle, and effortlessly timeless.

Crafted in lightweight cotton twill, it’s finished with subtle piping along the back yoke for a clean, refined touch.

A single flower appliqué sits at the centre back, adding a small moment of detail to this easy everyday kurta.
",https://cdn.shopify.com/s/files/1/0270/5129/4854/files/NBI047967_7.jpg?v=1763984172,https://www.nicobar.com/products/vestige-kurta-ivory,8500.0,Nicobar
412,Serene Pants - Ivory & Charcoal Print,"name: Serene Pants - Ivory & Charcoal Print, brand/slogan: Nicobar, description: 
Elevate your style effortlessly with the most versatile addition to your wardrobe – a pair of pants that seamlessly complement any look, whether dressed up or dressed down.

Form meets function, these pants feature two convenient patch pockets in the front, providing both practicality and a touch of flair.

Adding a delightful detail, they are beautifully adorned with red heart embroidery on the bottom corner of the pocket, lending a charming and unique element to the overall design.

Crafted in Bemberg and printed with charcoal stripes on an ivory base, they effortlessly pair with a variety of tops and accessories, making them a timeless and essential piece in your wardrobe.

Crafted from cotton linter, a natural byproduct of cottonseed oil production, Bemberg is a regenerated cellulose fibre that’s soft, breathable, and gentle on the skin. It’s biodegradable, compostable, and made using a closed-loop process that minimises waste, making it a thoughtful choice for you and the planet.
",https://cdn.shopify.com/s/files/1/0270/5129/4854/files/NBI046051_1.jpg?v=1753768983,https://www.nicobar.com/products/serene-pants-ivory-charcoal-print,4700.0,Nicobar
413,Bolt Jumpsuit - Denim,"name: Bolt Jumpsuit - Denim, brand/slogan: Nicobar, description: 
The Bolt Jumpsuit brings a fresh, easy energy to winter denim, the kind of piece that feels pulled-together without trying too hard.

Crafted in our signature blue denim, it’s designed with a relaxed, everyday silhouette that moves with you.

A heart-shaped patch pocket at the front and a subtle heart impression at the back add a playful signature to this all-season staple.
",https://cdn.shopify.com/s/files/1/0270/5129/4854/files/NBI047545_1.jpg?v=1763621233,https://www.nicobar.com/products/bolt-jumpsuit-denim,7000.0,Nicobar
414,Yin Yan Dress - Charcoal & White Print,"name: Yin Yan Dress - Charcoal & White Print, brand/slogan: Nicobar, description: 
The Yin Yan Dress plays with duality—striped up top, checked at the hem, and finished with an offbeat asymmetrical edge.

Constructed using two joined circles, it brings the yin and yang concept to life—balancing contrast through form and print.

In charcoal and white with a hand-drawn feel, it’s made for days when you want your outfit to do the talking.

A red pixelated heart at the back finishes the look.
",https://cdn.shopify.com/s/files/1/0270/5129/4854/files/NBI039475_1.jpg?v=1744291969,https://www.nicobar.com/products/yin-yan-dress-charcoal-white-print,6300.0,Nicobar
415,V-Neck Flared Kurta - Mint & Silver Print,"name: V-Neck Flared Kurta - Mint & Silver Print, brand/slogan: Nicobar, description: 
The V-Neck Flared Kurta brings a quiet gleam to everyday dressing—festive, but never loud.

Printed with silver foil florals on a mint Chanderi base, the silhouette flares gently for ease and movement, without added volume.

The light sheen adds just enough celebration to carry you through the season.

",https://cdn.shopify.com/s/files/1/0270/5129/4854/files/NBI046022_1.jpg?v=1753681583,https://www.nicobar.com/products/v-neck-flared-kurta-mint-silver-print,10000.0,Nicobar
416,Yoka Trousers - Charcoal,"name: Yoka Trousers - Charcoal, brand/slogan: Nicobar, description: 
Pocket full of personality! Our solid charcoal Yoka Trousers are an easy pick for a flared fit and to amp up your outfit.

Keep your essentials close at hand with the practical pocket design.

In soft cotton-linen, these pants will leave you feeling light as air.

A red heart is embroidered at the corner of the pocket—just a little something extra.
",https://cdn.shopify.com/s/files/1/0270/5129/4854/files/NBI046073_1.jpg?v=1753768983,https://www.nicobar.com/products/yoka-trousers-charcoal-1,5750.0,Nicobar
417,Lyla Top - Berry & Grey Stripes,"name: Lyla Top - Berry & Grey Stripes, brand/slogan: Nicobar, description: 
The Lyla Top in grey and berry stripes is crafted from 100% cotton thin single jersey offering a soft and breathable fit.

The top features a stylish combination of berry and grey stripes, adding a cool touch to your wardrobe. 

A subtle paw print in rust at the WRS bottom corner completes the look, making this piece both comfortable and effortlessly chic.
",https://cdn.shopify.com/s/files/1/0270/5129/4854/files/NBI037180_1.jpg?v=1736235494,https://www.nicobar.com/products/lyla-top-berry-grey-stripes,4450.0,Nicobar
418,Lyla Top - Olive & Grey Stripes,"name: Lyla Top - Olive & Grey Stripes, brand/slogan: Nicobar, description: 
The Lyla Top in grey and olive stripes is crafted from 100% cotton thin single jersey offering a soft and breathable fit.

The top features a stylish combination of olive and grey stripes, adding a cool touch to your wardrobe. 

A subtle paw print in rust at the WRS bottom corner completes the look, making this piece both comfortable and effortlessly chic.
",https://cdn.shopify.com/s/files/1/0270/5129/4854/files/NBI037178_1.jpg?v=1736235493,https://www.nicobar.com/products/lyla-top-olive-grey-stripes,4450.0,Nicobar
419,Sahara Skirt - Purple & Gold,"name: Sahara Skirt - Purple & Gold, brand/slogan: Nicobar, description: 
A celebration of craft and colour, the Sahara Skirt is designed to bring festive flair to any occasion. Whether you're dressing up for a gathering or adding a touch of tradition to everyday moments, this skirt captures the spirit of celebration.

Crafted in crisp 100% cotton in a rich, regal purple, it’s finished with a striking golden gota border that catches the light with every step.

The skirt is lined.

Delicate handcrafted fabric flower tassels—one green, one fuchsia—hang from the drawstring ends, each accented with a sequin for just a hint of sparkle.

Comes with pockets.
",https://cdn.shopify.com/s/files/1/0270/5129/4854/files/NBI046760_1.jpg?v=1757069750,https://www.nicobar.com/products/sahara-skirt-purple-gold,9450.0,Nicobar
420,Aurora Dress with Slip - Turmeric Yellow,"name: Aurora Dress with Slip - Turmeric Yellow, brand/slogan: Nicobar, description: 
The Aurora Dress is sunlit ease, cut in a colour that holds warmth and light in equal measure.

Crafted in breathable cotton kora, it’s layered over a multi-colour check slip trimmed with thin watermelon crochet lace at the neckline and hem.

The play continues with contrast trims at the cuffs, inside placket, and back yoke piping—small surprises that make this one extra special.

A foil-printed flower glints at the back—silver petals with a watermelon centre—placed just where the sun might catch it.









",https://cdn.shopify.com/s/files/1/0270/5129/4854/files/NBI045851_1.jpg?v=1752063189,https://www.nicobar.com/products/aurora-dress-with-slip-turmeric-yellow,9200.0,Nicobar
421,Longline Kimono - Ivory,"name: Longline Kimono - Ivory, brand/slogan: Nicobar, description: 
In a breezy fabric, this kimono has effortless style written all over it: T-shaped, front wrapping, with square sleeves that are super airy.

Crafted in soft cotton jacquard, it has an open fall and an adjustable belt. 

Comes in a classic palette, and the heart prints uplift the entire look.
",https://cdn.shopify.com/s/files/1/0270/5129/4854/files/NBI034010_1.jpg?v=1717098368,https://www.nicobar.com/products/longline-kimono-ivory,6550.0,Nicobar
422,Panaji Top - Red,"name: Panaji Top - Red, brand/slogan: Nicobar, description: 
The Panaji Top is a wardrobe essential with a touch of quiet romance. Its rich red hue offers a sophisticated base, while subtle details elevate the silhouette.

Crafted from cotton linter, a natural byproduct of cottonseed oil production, Bemberg is a regenerated cellulose fibre that’s soft, breathable, and gentle on the skin. It’s biodegradable, compostable, and made using a closed-loop process that minimises waste, making it a thoughtful choice for you and the planet.

A signature rose icon is delicately embroidered at the sleeve slits—red blooms with green leaves, mirrored perfectly on each side for visual harmony.
",https://cdn.shopify.com/s/files/1/0270/5129/4854/files/NBI046977_1.jpg?v=1757070315,https://www.nicobar.com/products/panaji-top-red,5000.0,Nicobar
423,Classic Pyjamas - Ivory & Fuchsia Embroidered,"name: Classic Pyjamas - Ivory & Fuchsia Embroidered, brand/slogan: Nicobar, description: 
Nicobar’s Classic Pyjamas pair well with your basics and are the definition of comfort in a classic shade ivory with fuchsia embroidery.

Crafted in cotton, this is a must-have pair for your wardrobe.
Effortlessly breezy, these flared pants will leave you feeling light as air.
",https://cdn.shopify.com/s/files/1/0270/5129/4854/files/NBI046687_1.jpg?v=1757069748,https://www.nicobar.com/products/classic-pyjamas-ivory-fuchsia-embroidered,5000.0,Nicobar
424,Novel Narrow Pants - Green Printed,"name: Novel Narrow Pants - Green Printed, brand/slogan: Nicobar, description: 
The Novel Narrow Pants feature a soft green base adorned with delicate pink vintage floral prints—bringing a hint of nostalgia to everyday dressing.

Crafted in lightweight 100% organic cotton voile.

Designed with a streamlined narrow fit and functional pockets, these pants offer both comfort and ease.
",https://cdn.shopify.com/s/files/1/0270/5129/4854/files/NBI046741_1.jpg?v=1757485764,https://www.nicobar.com/products/novel-narrow-pants-green-printed,4200.0,Nicobar
425,Lantern Top - Fuchsia & Lime Printed,"name: Lantern Top - Fuchsia & Lime Printed, brand/slogan: Nicobar, description: 
Bright and breezy, the Lantern Top in vibrant fuchsia brings a fresh, joyful energy to your festive wardrobe. Its playful lime abstract floral print adds a modern twist to classic silhouettes.

Made from 100% organic cotton voile, this top is lightweight and breathable.

Featuring a clean baby hem with an A-line silhouette, the Lantern Top offers a flattering, easy fit that flows gracefully.

Intricate check piping traces the pocket mouth, adding a subtle nod to detail.

",https://cdn.shopify.com/s/files/1/0270/5129/4854/files/NBI046650_1.jpg?v=1757911203,https://www.nicobar.com/products/lantern-top-fuchsia-lime-printed,3950.0,Nicobar
426,Basic Pyjamas - Mint & Watermelon Print,"name: Basic Pyjamas - Mint & Watermelon Print, brand/slogan: Nicobar, description: 
A style that's come to be our signature, this pyjama features an A-line silhouette that ends in a gentle flare.

The mint base is printed with a ditsy rose chintz, bringing in a soft, playful touch.

Crafted in 100% organic cotton voile, it pairs perfectly with kurtas and shirts alike, and promises to be the hardest working piece in your closet..
",https://cdn.shopify.com/s/files/1/0270/5129/4854/files/NBI045934_1.jpg?v=1753768983,https://www.nicobar.com/products/basic-pyjamas-mint-watermelon-print,4200.0,Nicobar
427,Waterfall Shirt - Black,"name: Waterfall Shirt - Black, brand/slogan: Nicobar, description: 
A modern take on your everyday black shirt featuring an edgy back-tie detail, the Waterfall Shirt’s back panel steals the show with its checked pattern, making a statement as you walk away.

A fuchsia heart embroidery is placed inside the placket, between the 2nd and 3rd buttons.This subtle yet striking detail adds a unique touch to the garment’s design.

Dress this piece up or down for effortless style to throw on and go.

Due to the uneven checks and colours of the fabric, each back tie will vary slightly, adding to the unique beauty of this style.
",https://cdn.shopify.com/s/files/1/0270/5129/4854/files/NBI037760_1.jpg?v=1738836690,https://www.nicobar.com/products/waterfall-shirt-black,4450.0,Nicobar
428,Basic Pyjama - Black & Mulberry Printed,"name: Basic Pyjama - Black & Mulberry Printed, brand/slogan: Nicobar, description: 
The Basic Pyjamas take on a new rhythm this season, reimagined in a striking black-and-mulberry print that feels bold, fluid, and unmistakably festive.

Crafted in soft, lightweight Bemberg, the silhouette stays true to its easy flared fit while the all-over floral print brings a touch of drama to the mix.

Contrast palm flowers bloom across the surface, adding movement and character to a pair designed to work effortlessly with kurtas, shirts, and every look you’re putting together.
",https://cdn.shopify.com/s/files/1/0270/5129/4854/files/NBI047819_1.jpg?v=1763621216,https://www.nicobar.com/products/basic-pyjama-black-mulberry-printed,4750.0,Nicobar
429,Pattaya Kurta with Slip - Watermelon,"name: Pattaya Kurta with Slip - Watermelon, brand/slogan: Nicobar, description: 
The Pattaya Kurta is fresh and full of quiet detail—made for moments that feel unhurried.

Crafted in yarn-dyed cotton-silk checks in watermelon and white, it’s paired with a tonal slip trimmed in ivory crochet lace at the neckline and hem.

A mint heart is embroidered at the sleeve hem, just beside the cuff pleat—small, intentional, and easy to miss (but never forget).
",https://cdn.shopify.com/s/files/1/0270/5129/4854/files/NBI046029_1.jpg?v=1753681587,https://www.nicobar.com/products/pattaya-kurta-with-slip-watermelon,10000.0,Nicobar
