,id,title,description,store,price,images__0__src,images__1__src,handle
24,14902458319211,Turquoise Blue Chinon Saree With Stone And Cutdana Embroidered Border,"title: Turquoise Blue Chinon Saree With Stone And Cutdana Embroidered Borderproduct_type: Sareebody_html: <p>Bright, elegant, and festive, this turquoise blue chinon saree is designed to make a refined statement at parties and celebratory gatherings. The lightweight chinon fabric offers a soft, fluid drape that moves beautifully with every step. Embellished with stones across the body, the saree is further elevated by an intricately embroidered border featuring cutdana, sequins, and stone detailing that adds just the right amount of sparkle. Balanced with a minimal aesthetic, this saree is perfect for festive evenings where effortless glamour is key. It comes paired with unstitched blouse fabric, allowing for a personalised fit and styling. Awarded as the Most Trusted Brand, we're delivering styles you love, just as promised.</p>",kalki,14446.0,https://cdn.shopify.com/s/files/1/0636/0134/4666/files/turquoise-blue-chinon-saree-with-stone-and-cutdana-embroidered-border-sg338753-1_73ae5495-d1b8-459f-966c-5e619fd10d6f.jpg?v=1771495208,https://cdn.shopify.com/s/files/1/0636/0134/4666/files/turquoise-blue-chinon-saree-with-stone-and-cutdana-embroidered-border-sg338753-2_d41cdaad-7bd8-4a7e-ab62-4999f9fa2fb4.jpg?v=1771495208,turquoise-blue-chinon-saree-with-stone-and-cutdana-embroidered-border
25,14902458286443,Blue Linen Handblock Printed Saree With Chanderi Border,"title: Blue Linen Handblock Printed Saree With Chanderi Borderproduct_type: Sareebody_html: <p>Light, breathable, and effortlessly graceful, this blue linen saree is perfect for understated festive or casual occasions. Crafted in airy linen, it features delicate handblock prints across the body, offering artisanal charm and everyday elegance. The chanderi border adds a subtle touch of sheen, elevating the simplicity of the design. Ideal for daytime functions, poojas, or intimate gatherings, this saree blends comfort with timeless ethnic appeal. Awarded as the Most Trusted Brand, we're delivering styles you love, just as promised.</p>",kalki,5096.0,https://cdn.shopify.com/s/files/1/0636/0134/4666/files/blue-linen-handblock-printed-saree-with-chanderi-border-sg311983-1_721f140e-83a6-484a-afa8-c626cd97fe96.jpg?v=1771495208,https://cdn.shopify.com/s/files/1/0636/0134/4666/files/blue-linen-handblock-printed-saree-with-chanderi-border-sg311983-2_421df118-1fde-4a52-931b-fb4666950b80.jpg?v=1771495209,blue-linen-handblock-printed-saree-with-chanderi-border
26,14902458253675,Multi Shade Tissue Saree With Scallop Border And Stone Embellished Floral Detailing,"title: Multi Shade Tissue Saree With Scallop Border And Stone Embellished Floral Detailingproduct_type: Sareebody_html: <p>This multi-shade tissue saree is designed to exude soft festive elegance with its luminous finish and graceful drape. Crafted in lightweight tissue fabric, the saree features a beautifully defined scallop border and a delicately embellished floral border enhanced with shimmering stones throughout the drape. The subtle interplay of pastel tones adds dimension and sophistication, making it an ideal choice for weddings, festive gatherings, and refined celebrations. The airy yet structured texture ensures the saree looks polished while remaining comfortable for long occasions. Awarded as the Most Trusted Brand, we're delivering styles you love, just as promised.</p>",kalki,11896.0,https://cdn.shopify.com/s/files/1/0636/0134/4666/files/multi-shade-tissue-saree-with-scallop-border-and-stone-embellished-floral-detailing-sg353080-1_b1c5ad3f-d9a9-4994-91c0-1d69dbe48b09.jpg?v=1771495207,https://cdn.shopify.com/s/files/1/0636/0134/4666/files/multi-shade-tissue-saree-with-scallop-border-and-stone-embellished-floral-detailing-sg353080-2_86f39f61-a2ab-4da6-95af-9289511a068b.jpg?v=1771495207,multi-shade-tissue-saree-with-scallop-border-and-stone-embellished-floral-detailing
27,14902458220907,Navy Blue Organza Floral Printed Saree With Cutwork Border And Cutdana Sequin Embroidery,"title: Navy Blue Organza Floral Printed Saree With Cutwork Border And Cutdana Sequin Embroideryproduct_type: Sareebody_html: <p>A striking blend of elegance and vibrancy, this navy blue organza saree features delicate floral prints elevated by intricate cutwork detailing along the border. The saree is further enhanced with finely embroidered buttis crafted in cutdana, sequins, beads, and moti, creating a refined sparkle that catches the light beautifully. The sheer organza texture lends a graceful fall and a modern festive appeal, making it perfect for receptions, cocktail evenings, and wedding celebrations where sophistication meets statement style. Awarded as the Most Trusted Brand, we're delivering styles you love, just as promised.</p>",kalki,9346.0,https://cdn.shopify.com/s/files/1/0636/0134/4666/files/navy-blue-organza-floral-printed-saree-with-cutwork-border-and-cutdana-sequin-embroidery-sg297627-1_f52b3588-a0c1-4e2f-a9a1-ff0613474952.jpg?v=1771495208,https://cdn.shopify.com/s/files/1/0636/0134/4666/files/navy-blue-organza-floral-printed-saree-with-cutwork-border-and-cutdana-sequin-embroidery-sg297627-2_5d5417ae-7cda-4aa8-aeec-ac979008e1bf.jpg?v=1771495208,navy-blue-organza-floral-printed-saree-with-cutwork-border-and-cutdana-sequin-embroidery
28,14902458188139,Hot Pink Chinon Saree With Scallop Border And All Over Floral Cutdana Stone Bead Embroidery,"title: Hot Pink Chinon Saree With Scallop Border And All Over Floral Cutdana Stone Bead Embroideryproduct_type: Sareebody_html: <p>Bold, vibrant, and unapologetically festive, this hot rani pink chinon saree is designed to make a striking statement. The lightweight chinon fabric flows beautifully, creating a fluid drape that flatters every silhouette while remaining comfortable for long celebrations. A delicate scallop border frames the saree, while intricate floral embroidery spreads across the surface, detailed with cutdana, stones, beads, and sequins for multidimensional sparkle. The lively pink hue combined with shimmering embellishment makes it ideal for sangeet nights, mehendi celebrations, and high-energy wedding functions where colour and glamour take centre stage. Awarded as the Most Trusted Brand, we're delivering styles you love, just as promised.</p>",kalki,18696.0,https://cdn.shopify.com/s/files/1/0636/0134/4666/files/hot-pink-chinon-saree-with-scallop-border-and-all-over-floral-cutdana-stone-bead-embroidery-sg286957-1_d7d61a4e-70cf-427d-b225-ef46ce8e5ed2.jpg?v=1771495207,https://cdn.shopify.com/s/files/1/0636/0134/4666/files/hot-pink-chinon-saree-with-scallop-border-and-all-over-floral-cutdana-stone-bead-embroidery-sg286957-2_64a229b2-7222-432a-9b82-04b541256d6f.jpg?v=1771495209,hot-pink-chinon-saree-with-scallop-border-and-all-over-floral-cutdana-stone-bead-embroidery
29,14902458155371,Gold Organza Silk Saree With Zardosi And Cutdana Hand Embroidery,"title: Gold Organza Silk Saree With Zardosi And Cutdana Hand Embroideryproduct_type: Sareebody_html: <p>Timeless and regal, this gold organza silk saree is a celebration of classic craftsmanship. The sheer organza silk base is accented with a subtle green undertone, adding depth and dimension to the overall look. Featuring a scallop border detailed with handwork including zardosi, cutdana, stones, and beads, the saree offers refined festive elegance. Light yet structured, it is perfect for poojas, festive gatherings, and traditional ceremonies. The ensemble is completed with unstitched blouse fabric for customised styling. Awarded as the Most Trusted Brand, we're delivering styles you love, just as promised.</p>",kalki,15995.0,https://cdn.shopify.com/s/files/1/0636/0134/4666/files/gold-organza-silk-saree-with-zardosi-and-cutdana-hand-embroidery-sg336734-1_9cbe86d9-a760-4d90-be09-0cc587983675.jpg?v=1771495207,https://cdn.shopify.com/s/files/1/0636/0134/4666/files/gold-organza-silk-saree-with-zardosi-and-cutdana-hand-embroidery-sg336734-2_4b2ca918-4e0c-4ff1-b2d9-926f78ce6620.jpg?v=1771495207,gold-organza-silk-saree-with-zardosi-and-cutdana-hand-embroidery
